{
  "$schema": "https://json-schema.org/draft/2020-12/schema",
  "$id": "https://debz.dev/schema/apt-system-result-v3",
  "title": "debz apt-shaped system facade result v3",
  "type": "object",
  "additionalProperties": false,
  "required": [
    "schema",
    "version",
    "api_version",
    "operation",
    "request_sha256",
    "profile",
    "outcome",
    "exit_status",
    "changed",
    "mutation_status",
    "recovery_context",
    "summary",
    "evidence",
    "diagnostics",
    "digest_sha256"
  ],
  "properties": {
    "schema": { "const": "https://debz.dev/schema/apt-system-result-v3" },
    "version": { "const": 3 },
    "api_version": { "const": 1 },
    "operation": {
      "enum": ["update", "install", "remove", "upgrade", "list_installed", "recover"]
    },
    "request_sha256": {
      "$ref": "apt-system-result-v1.json#/$defs/sha256"
    },
    "profile": {
      "oneOf": [
        {
          "$ref": "apt-system-result-v1.json#/$defs/profileBinding"
        },
        { "type": "null" }
      ]
    },
    "outcome": {
      "$ref": "apt-system-result-v1.json#/$defs/outcome"
    },
    "exit_status": { "enum": [0, 2, 3, 4, 5, 6, 7, 8, 70] },
    "changed": { "type": "boolean" },
    "mutation_status": {
      "enum": ["unchanged", "unknown"]
    },
    "recovery_context": {
      "oneOf": [
        {
          "$ref": "#/$defs/recoveryContext"
        },
        { "type": "null" }
      ]
    },
    "summary": { "type": "string", "minLength": 1, "maxLength": 4096 },
    "items": {
      "type": "array",
      "minItems": 1,
      "maxItems": 4096,
      "items": { "$ref": "#/$defs/item" }
    },
    "evidence": {
      "$ref": "apt-system-result-v1.json#/$defs/evidence"
    },
    "diagnostics": {
      "type": "array",
      "maxItems": 8,
      "items": {
        "$ref": "apt-system-result-v1.json#/$defs/diagnostic"
      }
    },
    "digest_sha256": {
      "$ref": "apt-system-result-v1.json#/$defs/sha256"
    }
  },
  "allOf": [
    { "$ref": "apt-system-result-v1.json#/allOf/0" },
    { "$ref": "apt-system-result-v1.json#/allOf/1" },
    { "$ref": "apt-system-result-v1.json#/allOf/2" },
    { "$ref": "apt-system-result-v1.json#/allOf/3" },
    { "$ref": "apt-system-result-v1.json#/allOf/4" },
    { "$ref": "apt-system-result-v1.json#/allOf/5" },
    { "$ref": "apt-system-result-v1.json#/allOf/6" },
    { "$ref": "apt-system-result-v1.json#/allOf/7" },
    { "$ref": "apt-system-result-v1.json#/allOf/8" },
    {
      "if": {
        "properties": {
          "outcome": { "const": "success" },
          "changed": { "const": false },
          "operation": { "enum": ["install", "remove", "upgrade"] }
        },
        "required": ["outcome", "changed", "operation"]
      },
      "then": {
        "properties": {
          "evidence": {
            "properties": {
              "exact_lock": { "$ref": "apt-system-result-v1.json#/$defs/documentBinding" },
              "transaction_result": { "type": "null" },
              "root_operation_completion": { "type": "null" },
              "active_operation_state": { "$ref": "apt-system-result-v1.json#/$defs/absolutePath" }
            }
          }
        }
      },
      "else": { "$ref": "apt-system-result-v1.json#/allOf/9" }
    },
    { "$ref": "apt-system-result-v1.json#/allOf/10" },
    {
      "oneOf": [
        {
          "properties": {
            "operation": { "enum": ["install", "remove", "upgrade"] },
            "outcome": { "const": "success" },
            "changed": { "const": false },
            "mutation_status": { "const": "unchanged" },
            "recovery_context": { "type": "null" }
          },
          "not": { "required": ["items"] }
        },
        {
          "properties": {
            "operation": {
              "enum": ["install", "remove", "upgrade"]
            },
            "outcome": { "const": "usage" },
            "changed": { "const": false },
            "mutation_status": { "const": "unchanged" },
            "recovery_context": { "type": "null" },
            "diagnostics": {
              "minItems": 1,
              "maxItems": 1,
              "contains": {
                "properties": {
                  "id": { "const": "confirmation_required" },
                  "phase": { "const": "confirmation" }
                },
                "required": ["id", "phase"]
              }
            }
          },
          "required": ["items"]
        },
        {
          "properties": {
            "operation": { "const": "recover" },
            "outcome": { "const": "recovery" },
            "changed": { "const": false },
            "mutation_status": { "const": "unknown" },
            "recovery_context": {
              "allOf": [
                { "$ref": "#/$defs/recoveryContext" },
                {
                  "properties": {
                    "action": { "type": "null" }
                  }
                }
              ]
            },
            "profile": { "type": "null" },
            "evidence": {
              "properties": {
                "exact_lock": { "type": "null" },
                "transaction_result": { "type": "null" },
                "root_operation_completion": { "type": "null" },
                "active_operation_state": { "type": "null" }
              }
            },
            "diagnostics": {
              "minItems": 1,
              "maxItems": 1,
              "contains": {
                "properties": {
                  "id": { "const": "recovery_required" },
                  "phase": { "const": "recovery" }
                },
                "required": ["id", "phase"]
              }
            }
          },
          "not": { "required": ["items"] }
        }
      ]
    }
  ],
  "$defs": {
    "recoveryContext": {
      "type": "object",
      "additionalProperties": false,
      "required": ["profile_path", "requested_operation", "action"],
      "properties": {
        "profile_path": {
          "$ref": "apt-system-request-v1.json#/$defs/absolutePath"
        },
        "requested_operation": {
          "oneOf": [
            {
              "enum": ["update", "install", "remove", "upgrade", "list_installed"]
            },
            { "type": "null" }
          ]
        },
        "action": {
          "oneOf": [
            {
              "type": "string",
              "minLength": 1,
              "maxLength": 8192,
              "pattern": "^debz recover --system-profile /"
            },
            { "type": "null" }
          ]
        }
      }
    },
    "item": {
      "type": "object",
      "additionalProperties": false,
      "required": ["package", "version", "architecture", "detail"],
      "properties": {
        "package": {
          "type": "string",
          "minLength": 1,
          "maxLength": 255,
          "pattern": "^[A-Za-z0-9][A-Za-z0-9+.:=-]*$"
        },
        "version": {
          "oneOf": [
            { "type": "string", "minLength": 1, "maxLength": 1024 },
            { "type": "null" }
          ]
        },
        "architecture": {
          "oneOf": [
            { "type": "string", "minLength": 1, "maxLength": 64 },
            { "type": "null" }
          ]
        },
        "detail": {
          "oneOf": [
            { "type": "string", "minLength": 1, "maxLength": 4096 },
            { "type": "null" }
          ]
        }
      }
    }
  }
}
