{"schema":"https://debz.dev/schema/apt-system-result-v3","version":3,"api_version":1,"operation":"recover","request_sha256":"a2caf37616edf65c99424fc973768c4e17a3ecb6c510ee75b9671523924b91ae","profile":null,"outcome":"recovery","exit_status":8,"changed":false,"mutation_status":"unknown","recovery_context":{"profile_path":"/profile.json","requested_operation":"install","action":null},"summary":"mutation status unknown","evidence":{"exact_lock":null,"transaction_result":null,"root_operation_completion":null,"active_operation_state":null},"diagnostics":[{"id":"recovery_required","outcome":"recovery","phase":"recovery","message":"mutation status unknown"}],"digest_sha256":"55b6b9375ec0d5f1b6e5f6aafba3e1bcb6e74ec3d4588666d2d7b9933df26303"}
