{"schema":"https://debz.dev/schema/apt-system-result-v3","version":3,"api_version":1,"operation":"install","request_sha256":"396838fa1cb3f41cf7f23357568117d745161f94866640c8827897439662a46d","profile":{"path":"/profile.json","sha256":"2222222222222222222222222222222222222222222222222222222222222222","reference_evidence_sha256":"3333333333333333333333333333333333333333333333333333333333333333"},"outcome":"usage","exit_status":2,"changed":false,"mutation_status":"unchanged","recovery_context":null,"summary":"confirmation required","items":[{"package":"xxxxx","version":"xxx","architecture":"xxxxx","detail":null}],"evidence":{"exact_lock":{"path":"/state/exact-lock.json","schema":"io.github.cataggar.debz.exact-closure-lock.v2","version":2,"digest_sha256":"4444444444444444444444444444444444444444444444444444444444444444"},"transaction_result":null,"root_operation_completion":null,"active_operation_state":null},"diagnostics":[{"id":"confirmation_required","outcome":"usage","phase":"confirmation","message":"confirmation required"}],"digest_sha256":"53838380c9e1c925d56ca75a0ec01fc036d9f063a3483ddd487c0469c58ad25c"}
